rid,id,text
Review-g230021-d742004_2,Review-g230021-d742004_2:14,-het hapje was correct en zurig fris.
Review-g230021-d742004_2,Review-g230021-d742004_2:15,Het brood was lekker.
Review-g230021-d742004_2,Review-g230021-d742004_2:16,"-het voorgerecht, extra zachte gerookte zalm, was standaardkwaliteit van de groothandel."
Review-g230021-d742004_2,Review-g230021-d742004_2:17,De vetnaad vlakbij het staartstuk van de zalm die hard wordt bij het roken was niet weggesneden door de keuken.
Review-g230021-d742004_2,Review-g230021-d742004_2:18,"-de fondue was lekker, de frietjes vers, de sausjes industrieel."
Review-g230021-d742004_2,Review-g230021-d742004_2:19,"-er wordt gevraagd of er nog wat frietjes moeten zijn, waarop snel nog een kommetje volgt."
Review-g230021-d742004_2,Review-g230021-d742004_2:20,-er wordt iets later gevraagd of er nog wat vlees mag zijn; 'graag 'antwoorden wij; 'een half bordje volstaat'
Review-g230021-d742004_2,Review-g230021-d742004_2:21,-17 minuten later komt de opdienster om af te ruimen.
Review-g230021-d742004_2,Review-g230021-d742004_2:22,'Wij wachten nog op vlees 'antwoordden wij.
Review-g230021-d742004_2,Review-g230021-d742004_2:23,Waarna een via iemand anders van de bediening de communicatie een tweede maal naar de keuken gaat.
Review-g230021-d742004_2,Review-g230021-d742004_2:24,Nonchalance van de keuken of een onduidelijke bestelling 17 minuten eerder van de bediening aan de keuken?
Review-g230021-d742004_2,Review-g230021-d742004_2:25,De chef schiet zich aan zijn snijmachine en het vlees volgt.
Review-g230021-d742004_2,Review-g230021-d742004_2:26,"De frieten zijn ondertussen uiteraard koud, maar we vragen er geen warme meer, wie weet wanneer we ze krijgen."
Review-g230021-d742004_2,Review-g230021-d742004_2:27,De keuken is overbemand in vergelijking met de zaal.
Review-g230021-d742004_2,Review-g230021-d742004_2:28,Het zaalpersoneel wordt aan hun lot overgelaten: pompen of verzuipen.
Review-g230021-d742004_2,Review-g230021-d742004_2:29,De stress van het zaalpersoneel en het onnodig (inefficiënt) drukdoend heen en weer lopen straalt af op de klanten en bepaalt de sfeer in de zaak.
Review-g230021-d742004_2,Review-g230021-d742004_2:30,Genieten is hier moeilijk.
Review-g230021-d742004_2,Review-g230021-d742004_2:31,De akoestiek is een heikel punt.
Review-g230021-d742004_2,Review-g230021-d742004_2:32,Vanaf een kleine klantenbezetting moet je reeds je stem verheffen om een duidelijk gesprek met je partner te kunnen voeren.
Review-g230021-d742004_2,Review-g230021-d742004_2:33,"Een akoestisch spanplafond, 3D-tegels,... als oplossing?"
Review-g230021-d742004_2,Review-g230021-d742004_2:34,Als er tijdens het service meermaals couverts worden afgewassen en deze vervolgens terug in de juiste vakken worden geworpen en bovendien alle afwas onzacht op elkaar wordt gestapeld dan maakt dit allemaal onnodig lawaai doorheen de volledige zaal.
Review-g230021-d742004_2,Review-g230021-d742004_2:35,"Bij gebrek aan een e-mailadres op de website kan ik deze feedback niet rechtstreeks aan de eigenaar doorgeven, maar dien ik ze hier te posten..."
Review-g230021-d742004_4,Review-g230021-d742004_4:1,"Bij het betreden van dit restaurant, sprak men mij in het Frans aan."
Review-g230021-d742004_4,Review-g230021-d742004_4:2,"Toen ik vroeg of men Nederlands sprak, was het antwoord 'non'."
Review-g230021-d742004_4,Review-g230021-d742004_4:3,Mijn honger was dus over en ik heb rechtsomkeer gemaakt.
Review-g230023-d742208_1,Review-g230023-d742208_1:1,Ik las de negatieve recensies op Tripadvisor toen we al op het terras van restaurant Holiday zaten en was een beetje bang VOO wat er zou komen...
Review-g230023-d742208_1,Review-g230023-d742208_1:2,"Uiteindelijk was ik blij verrast, wij hebben een fijne bediening gehad van vriendelijk personeel."
Review-g230023-d742208_1,Review-g230023-d742208_1:3,"Het eten was ok, ik nam de vissuggestie van de dag en dit was een correct gerecht voor een correcte prijs."
Review-g230023-d742208_1,Review-g230023-d742208_1:4,Geen culinaire hoogstandjes maar daarvoor heb je andere etablissementen in Nieuwpoort.
Review-g230023-d742208_1,Review-g230023-d742208_1:5,Ik vind de negatieve kritieken dan ook zeer overdreven!
Review-g230023-d742208_4,Review-g230023-d742208_4:1,We hebben allebei pizza frutti di mare gegeten en deze was qua prijs/kwaliteit best ok.
Review-g230023-d742208_4,Review-g230023-d742208_4:2,"Lekker veel kaas, geen uitgedroogde korst zoals je vaak tegenkomt, eigenlijk ook best luchtig."
Review-g230023-d742208_4,Review-g230023-d742208_4:3,"Bij de bediening liep er echter iemand rond die geen woord Nederlands kon, dat vind ik voor Nieuwpoort absoluut niet kunnen."
Review-g230023-d742208_4,Review-g230023-d742208_4:4,We vroegen bij onze aperitief trouwens een portie olijven maar dat was niet mogelijk.
Review-g230023-d742208_4,Review-g230023-d742208_4:5,Bij zo goed als elke Italiaan krijg je dit standaard op tafel!
Review-g230023-d742208_4,Review-g230023-d742208_4:6,Hier dus niet...
Review-g230023-d742208_4,Review-g230023-d742208_4:7,Maar wat we kregen was dus lekker.
Review-g2369819-d4170174_1,Review-g2369819-d4170174_1:1,Het Hof van Heusden is op zich wat een speciale locatie.
Review-g2369819-d4170174_1,Review-g2369819-d4170174_1:2,Het lijkt inderdaad bij binnenkomst eerder een café -en dat is het ook want je kan er gewoon iets drinken of eten.
Review-g2369819-d4170174_1,Review-g2369819-d4170174_1:3,Maar achteraan bevindt zich het restaurant.
Review-g2369819-d4170174_1,Review-g2369819-d4170174_1:4,En aan het restaurant is een groot terras.
Review-g2369819-d4170174_1,Review-g2369819-d4170174_1:5,Dus even door het café naar het restaurant lopen.
Review-g2369819-d4170174_1,Review-g2369819-d4170174_1:6,En dat is best gezellig ingericht!
Review-g2369819-d4170174_1,Review-g2369819-d4170174_1:7,Abdel is top: hij kookt erg lekker en wij vinden vooral dat hij een meester is in het klaarmaken van wild.
Review-g2369819-d4170174_1,Review-g2369819-d4170174_1:8,Dus in het wildseizoen: allen daarheen!
Review-g2369819-d4170174_1,Review-g2369819-d4170174_1:9,In de zomer is er een groot terras-met een tuin.
Review-g2369819-d4170174_1,Review-g2369819-d4170174_1:10,Wij houden van dit restaurant vooral omwille van de keuken en vriendelijkheid van Abdel.
Review-g2369819-d4170174_1,Review-g2369819-d4170174_1:11,En we gaan vooral in de wintermaanden graag op bezoek!
Review-g2369819-d4170174_2,Review-g2369819-d4170174_2:1,Maandmenu: Het 'fijnproeversbordje' bestond uit een toastje van 1 vierkante centimeter met een stukje pate op en iets dat gelijkt op uienkonfijt.
Review-g2369819-d4170174_2,Review-g2369819-d4170174_2:2,De boter die we bij de 3 stukken brood kregen (voor 2 personen) had de vervaldatum 12/12/13 (bijna een maand over datum)
Review-g2369819-d4170174_2,Review-g2369819-d4170174_2:3,De carpacio (tataki op het menu) was waterachtig en inspiratieloos.
Review-g2369819-d4170174_2,Review-g2369819-d4170174_2:4,Het hoofdgerecht (varkenswangetjes) was lekker.
Review-g2369819-d4170174_2,Review-g2369819-d4170174_2:5,De wijnen kunnen enkel besteld worden per glas of per halve liter??? behalve de huiswijn..
Review-g2369819-d4170174_2,Review-g2369819-d4170174_2:6,Die kon per fles worden besteld.
Review-g2369819-d4170174_2,Review-g2369819-d4170174_2:7,Ik ga er dus van uit dat de 'betere wijnen' uit een vat komen?
Review-g2369819-d4170174_2,Review-g2369819-d4170174_2:8,De zaal zat vol mensen die met de Grouponbon kwamen eten.
Review-g2369819-d4170174_2,Review-g2369819-d4170174_2:9,"Hun menu die zowat de helft van de onze kostte, zag er in elk geval veel beter uit."
Review-g2369819-d4170174_2,Review-g2369819-d4170174_2:10,"De zaak ontbreekt sfeer, wij hebben absoluut geen goed gevoel na dit etentje."
Review-g2369819-d4170174_2,Review-g2369819-d4170174_2:11,Er zijn in Destelbergen en Heusden veel resto's met een veel betere prijs-kwaliteitsverhouding.
Review-g2369819-d4170174_2,Review-g2369819-d4170174_2:12,Hier is nog veel werk aan..
Review-g2369819-d4170174_3,Review-g2369819-d4170174_3:1,We hadden dit restaurant uitgekozen met een Groupon bon.
Review-g2369819-d4170174_3,Review-g2369819-d4170174_3:2,Maar we waren teleurgesteld bij aankomst.
Review-g2369819-d4170174_3,Review-g2369819-d4170174_3:3,Het was precies een café waar je iets gaat drinken en het was er zeker niet romantisch ingericht.
Review-g2369819-d4170174_3,Review-g2369819-d4170174_3:4,Het eten was wel lekker en mooi gepresenteerd op het bord.
Review-g2369819-d4170174_3,Review-g2369819-d4170174_3:5,Maar van het personeel kon er ook geen glimlachje af.
Review-g2369819-d4170174_4,Review-g2369819-d4170174_4:1,Reeds 5 keer heb ik dit restaurant bezocht en nooit een een ontgoocheling gehad.
Review-g2369819-d4170174_4,Review-g2369819-d4170174_4:2,( anders kom je niet terug)
Review-g2369819-d4170174_4,Review-g2369819-d4170174_4:3,De ontvangst is steeds gastvrij en prijs/kwaliteit ligt uitstekend.
Review-g2369819-d4170174_4,Review-g2369819-d4170174_4:4,Dit weekend genoten van het degustatiemenu geënt op het wildseizoen.
Review-g2369819-d4170174_4,Review-g2369819-d4170174_4:5,De amuse is reeds verrassend en een voorbode van een veelbelovend menu.
Review-g2369819-d4170174_4,Review-g2369819-d4170174_4:6,"Carpaccio van everzwijn, patrijs met rode biet & boschampignons zijn stuk voor stuk verrassende combinaties."
Review-g2369819-d4170174_4,Review-g2369819-d4170174_4:7,Neem daar een afsluiter bij met vanilleijs en bosbessen en de avond kan niet meer stuk.
Review-g2369819-d4170174_4,Review-g2369819-d4170174_4:8,"5 gangen voor 45,00 euro is een eerlijke prijs voor een voorstreffelijk menu."
Review-g2369819-d4170174_4,Review-g2369819-d4170174_4:9,Reserveren met de kinderen en kleinkinderen was steeds geslaagd.
Review-g2369819-d4170174_4,Review-g2369819-d4170174_4:10,Akkoord dat een smulbox voor de kleintjes misschien wat fastfoodachtig is maar ze lusten het gewoon.
Review-g2369819-d4170174_4,Review-g2369819-d4170174_4:11,Dit restaurant is zeker niet de top maar jong talent verdient en ruggesteuntje.
Review-g2369819-d4736237_1,Review-g2369819-d4736237_1:1,Wij bezoeken dit restaurant regelmatig omdat je hier de beste pizza uit de streek vindt.
Review-g2369819-d4736237_1,Review-g2369819-d4736237_1:2,Mateo is niet voor niets verkozen tot beste pizza-bakker van Oost-Vlaanderen.
Review-g2369819-d4736237_1,Review-g2369819-d4736237_1:3,Bovendien houden wij van de gezellige familiale sfeer.
Review-g2369819-d4736237_1,Review-g2369819-d4736237_1:4,Er is een uitstekende wijnkaart die regelmatig vernieuwd wordt.
Review-g2369819-d4736237_1,Review-g2369819-d4736237_1:5,Ook het gewone menu kent regelmatig afwisseling.
Review-g2369819-d4736237_1,Review-g2369819-d4736237_1:6,Wel proberen wij de weekend te vermijden want dan kan het behoorlijk druk worden.
Review-g2369819-d4736237_1,Review-g2369819-d4736237_1:7,"Iedereen slooft zich dan wel uit om het de klanten naar de zin te maken, doch men kan ook niet meer doen dan menselijkerwijs mogelijk is."
Review-g2369819-d4736237_1,Review-g2369819-d4736237_1:8,Slachtoffer van eigen succes zou men kunnen zeggen.
Review-g2369819-d4736237_1,Review-g2369819-d4736237_1:9,Reserveren en informeren is dus de boodschap.
Review-g2369819-d4736237_2,Review-g2369819-d4736237_2:1,"Niets hartelijk, vriendelijk!"
Review-g2369819-d4736237_2,Review-g2369819-d4736237_2:2,Gewoon onbeleefde bediening.
Review-g2369819-d4736237_2,Review-g2369819-d4736237_2:3,Alsof alles tegen haar zin was.
Review-g2369819-d4736237_2,Review-g2369819-d4736237_2:4,Ik hoop dat dit een momentopname was (slecht dagje)
Review-g2369819-d4736237_2,Review-g2369819-d4736237_2:5,Wij komen hier in elk geval NOOIT nog terug.
Review-g2369819-d4736237_2,Review-g2369819-d4736237_2:6,"Het eten was niet slecht, maar dat kon de onbeleefdheid van de gastvrouw niet goed maken."
Review-g2369819-d4736237_2,Review-g2369819-d4736237_2:7,Genoeg restaurants in Destelbergen waar ze niet tegen hun zin werken.
Review-g2369819-d4736237_3,Review-g2369819-d4736237_3:1,"Aanvankelijk hadden mijn vriend en ik wel wat ""drempelvrees"" om hier binnen te komen, daar het interieur er wat rommelig uitzag."
Review-g2369819-d4736237_3,Review-g2369819-d4736237_3:2,Maar we overwonnen onze schrik en kregen de verrassing van ons leven!
Review-g2369819-d4736237_3,Review-g2369819-d4736237_3:3,"We werden geweldig vriendelijk onthaald en voelden ons meteen thuis in dit sympathieke, familiale restaurantje."
Review-g2369819-d4736237_3,Review-g2369819-d4736237_3:4,"Helemaal niet sjiek of zo, eerder eenvoudig, je waant je in een Italiaanse huiskamer..."
Review-g2369819-d4736237_3,Review-g2369819-d4736237_3:5,"Het eten was geweldig, nooit heb ik Italië zo nabij gevoeld als in de Etna."
Review-g2369819-d4736237_3,Review-g2369819-d4736237_3:6,"De kok heeft prijzen gewonnen voor ""beste pizzaiolo van Vlaanderen'"" en is hier heel trots op."
Review-g2369819-d4736237_3,Review-g2369819-d4736237_3:7,De foto's en getuigschriften hangen aan de muur.
Review-g2369819-d4736237_3,Review-g2369819-d4736237_3:8,Tot nu toe mijn beste ervaring met de authentieke Italiaanse keuken in ons Belgenlandje.
Review-g2369819-d4736237_3,Review-g2369819-d4736237_3:9,Ook de prijs is heel redelijk.
Review-g2369819-d4736237_3,Review-g2369819-d4736237_3:10,"Ik kom hier zéker terug, zeker weten!!!!"
Review-g2369819-d4736237_4,Review-g2369819-d4736237_4:1,Super lekkere pasta's en pizza's gegeten!
Review-g2369819-d4736237_4,Review-g2369819-d4736237_4:2,"De kok, Mateo is een Italiaan."
Review-g2369819-d4736237_4,Review-g2369819-d4736237_4:3,"Hartelijke ontvangst, goed om vooraf te reserveren."
Review-g2369819-d4736237_4,Review-g2369819-d4736237_4:4,prijs is gemiddeld.
Review-g2369819-d4736237_4,Review-g2369819-d4736237_4:5,Ook de formule 'pizza party' is een schot in de roos!!
Review-g2369819-d4736237_4,Review-g2369819-d4736237_4:6,In de zomer groot zonneterras.
Review-g2546789-d4542241_2,Review-g2546789-d4542241_2:1,Ik had een steak saignant gevraagd maar deze was medium tot bien cuit.
Review-g2546789-d4542241_2,Review-g2546789-d4542241_2:2,Als ik hierover een opmerking maakte kreeg ik hetzelfde vlees gewoon terug met de melding dat ik verkeerd was.
Review-g2546789-d4542241_2,Review-g2546789-d4542241_2:3,Voor de rest weinig creatieve keuken.
Review-g2546789-d4542241_2,Review-g2546789-d4542241_2:4,Geen aanrader.
Review-g2546789-d4542241_3,Review-g2546789-d4542241_3:1,"Zondag 30 maart, prachtig weer dus terrasje onderweg: Redelijk veel klanten en voldoende personeel dat echter totaal niet geinteresseerd was om de mensen te bedienen."
Review-g2546789-d4542241_3,Review-g2546789-d4542241_3:2,"Wij hebben daar een dik halfuur geprobeerd de aandacht te trekken van de kelners, die voorbij slenterden zonder enioge bestelling op te nemen."
Review-g2546789-d4542241_3,Review-g2546789-d4542241_3:3,Uiteindelijk zijn we hongerig en dorstig dan maar terug opgestapt.
Review-g2546789-d4542241_3,Review-g2546789-d4542241_3:4,"Zulk een een onbeschofte, en ongeintersseerde bediening heb ik nog nergers meegemaakt."
Review-g2546789-d4542241_3,Review-g2546789-d4542241_3:5,Gewoon onbegrijpelijk.
Review-g2546789-d4542241_3,Review-g2546789-d4542241_3:6,Ons zien ze daar NOOIT meer.
Review-g2546789-d4542241_4,Review-g2546789-d4542241_4:1,""" De jongste telg ""heeft als voornaamste troef de prachtige tuin waar het voor gezinnen met kinderen en grotere groepen goed toeven is, ware het niet dat het huidige management het concept drastisch veranderd heeft."
Review-g2546789-d4542241_4,Review-g2546789-d4542241_4:2,"Op zondagnamiddag is er ""animatie"" in de vorm van een ""dinner show"", een arrangementje dat €70,- kost, maar dan krijg je wel entertainment van schlagergoden à la Frank Galan, Danny Fabri, Paul Severs en tutti quanti."
Review-g2546789-d4542241_4,Review-g2546789-d4542241_4:3,Alleen maar geschikt voor een beperkt nichepubliek.
Review-g2546789-d4542241_4,Review-g2546789-d4542241_4:4,"Wij dachten rustig iets te gaan eten in de tuin (dan betaal je de €70,- niet en kan je enkel bestellen uit de snacks-kaart) maar ook daar worden de decibels royaal in je richting gestuurd (arme buren!)."
Review-g2546789-d4542241_4,Review-g2546789-d4542241_4:5,We hebben snel en zonder smaak gegeten en hebben gemaakt dat we weer weg waren.
Review-g2546789-d4542241_4,Review-g2546789-d4542241_4:6,"Hou je van Vlaamse en andere schlagers: ga ervoor, betaal geen €70,- en zet je in de tuin; hou je er niet van, gewoon wegblijven."
Review-g3492038-d2669477_1,Review-g3492038-d2669477_1:1,het nieuwe gebouw lijkt op een openbaar zwembad of turnzaal.
Review-g3492038-d2669477_1,Review-g3492038-d2669477_1:2,Hoe haalt men het in z'n hoofd om een zaak met traditie en nostalgie op zo een vreselijke manier te vernieuwen!
Review-g3492038-d2669477_1,Review-g3492038-d2669477_1:3,gezelligheid is hier mijlen ver te zoeken!
Review-g3492038-d2669477_3,Review-g3492038-d2669477_3:1,"Je kan hier rustig iets eten en drinken, de prijzen zijn iets hoger als normaal maar je krijgt dan ook wel waar voor je geld."
Review-g3492038-d2669477_3,Review-g3492038-d2669477_3:2,Ook een speeltuin voor de kinderen is aanwezig en in de zomer is het hier ook zeker gezellig vertoeven.
Review-g3492038-d2669477_4,Review-g3492038-d2669477_4:1,Geen probleem om in dit restaurant/café nog een maaltijd te krijgen rond 21u30.
Review-g3492038-d2669477_4,Review-g3492038-d2669477_4:2,Bediening was vlot en gebeurde snel.
Review-g3492038-d2669477_4,Review-g3492038-d2669477_4:3,"Er is in dit etablissement heel wat plaats om te zitten, toch slaagt men er in om zelfs op een weekdag bijna alle plaatsen bezet te krijgen."
Review-g3607018-d1444065_2,Review-g3607018-d1444065_2:1,Het ontbijt was weeral uitstekend!
Review-g3607018-d1444065_2,Review-g3607018-d1444065_2:2,"Prima organisatie, veel variatie, voor ieder wat wils."
Review-g3607018-d1444065_2,Review-g3607018-d1444065_2:3,"Vriendelijke bediening, gezellig interieur en dat allemaal op een mooie groene locatie."
Review-g3607018-d1444065_2,Review-g3607018-d1444065_2:4,Wij komen graag nog eens terug!
Review-g3607018-d1444065_4,Review-g3607018-d1444065_4:1,"Heel gezellig restaurant in een fantastische omgeving in de bossen, ideaal als fietsstopplaats waar het lekker eten is, maar ook de moeite om gewoon wat gaan te drinken op het gezellige terras naast de gempemolen"
Review-g641779-d740846_1,Review-g641779-d740846_1:1,"Heel lekker, vriendelijke ontvangst, super goede bediening, hulpzaam en perfecte uitleg over de gerechten!"
Review-g641779-d740846_1,Review-g641779-d740846_1:2,Prijs kwaliteit een perfecte aanrader!
Review-g641779-d740846_2,Review-g641779-d740846_2:1,"Mooie keuzes, zeer evenwichtig, zeer goed opgeleid en vriendelijk personeel."
Review-g641779-d740846_2,Review-g641779-d740846_2:2,"lekkere maaltijden en uitstekende wijnen, wel prijzig."
Review-g641779-d740846_4,Review-g641779-d740846_4:1,Wij zijn er al verschillende keren gaan eten.
Review-g641779-d740846_4,Review-g641779-d740846_4:2,Telkens weer GENIETEN!!
Review-g641779-d740846_4,Review-g641779-d740846_4:3,Super vriendelijke gastvrouw!
Review-g641779-d740846_4,Review-g641779-d740846_4:4,Fantastisch lekker eten!
Review-g641779-d740846_4,Review-g641779-d740846_4:5,Een echt smaakfestival!
Review-g641779-d740846_4,Review-g641779-d740846_4:6,Tot nu toe geen enkel ander restaurant gevonden dat hieraan kan tippen!
Review-g641781-d741267_1,Review-g641781-d741267_1:1,Onvriendelijke mensen -knettergek -slechtste eten ooit -don't go there!!!!
Review-g641781-d741267_1,Review-g641781-d741267_1:2,En dan klagen de mensen in de horeca...
Review-g641781-d741267_2,Review-g641781-d741267_2:1,"in het kader van een flairbon hebben wij gereserveerd bij ""de mein"" het soepje van asperge was lekker doch geen brood, boter bij geserveerd."
Review-g641781-d741267_2,Review-g641781-d741267_2:2,de rundsbrochette was doorregen en taai (alle 5 blokjes op de spies) en at als een kauwgom.
Review-g641781-d741267_2,Review-g641781-d741267_2:3,"de vis (zalm) at lekker, doch tafel naast ons vroeg een beetje botersaus bij en de ober antwoordde: ""saus is op."
Review-g641781-d741267_2,Review-g641781-d741267_2:4,Bij de derde gang was er geen crème brullée in het aanbod terwijl dit wel in de bon opgegeven was.
Review-g641781-d741267_2,Review-g641781-d741267_2:5,Bij het afsluiten van de avond vroegen wij om een decafeïne koffie
Review-g641781-d741267_2,Review-g641781-d741267_2:6,"u raadt het antwoord: ""Is er niet""."
Review-g641781-d741267_2,Review-g641781-d741267_2:7,de nacht die erop volgde was een hel.
Review-g641781-d741267_2,Review-g641781-d741267_2:8,mijn vrouw de helenacht overgegeven en diaree.
Review-g641781-d741267_2,Review-g641781-d741267_2:9,Dus eindconclusie: nog teveel betaald en om 18u stipt binnengekomen en om 21.15u buiten gegaan.
Review-g641781-d741267_2,Review-g641781-d741267_2:10,De ober was ook niet overdreven vriendelijk en vrij stuurs...
Review-g641781-d741267_3,Review-g641781-d741267_3:1,"na niet genoterde reservatie (volgens vivabox) hebben ze ons nooit willen dienen, en dit na anderhalf uur wachten."
Review-g641781-d741267_3,Review-g641781-d741267_3:2,Proficiat en succes in de toekomst..
Review-g641781-d741267_4,Review-g641781-d741267_4:1,Ronduit schandalig wat ze serveren.
Review-g641781-d741267_4,Review-g641781-d741267_4:2,Nog nooit zo slecht gegeten.
Review-g641781-d741267_4,Review-g641781-d741267_4:3,steppegras met soepvlees gekregen die eventjes tss gril gestoken heeft.
Review-g641781-d741267_4,Review-g641781-d741267_4:4,Komt zelfs niet in aanmerking voor frituur.
Review-g641781-d741267_4,Review-g641781-d741267_4:5,Stop gewoon hiermee.
Review-g641785-d1140849_2,Review-g641785-d1140849_2:1,Naar mijn beleving was er voor de lunch buiten gereserveerd maar het bleek binnen in een apart zaaltje.
Review-g641785-d1140849_2,Review-g641785-d1140849_2:2,Het was bijzonder gehorig en lawaaierig.
Review-g641785-d1140849_2,Review-g641785-d1140849_2:3,Het eten was prima maar ik zou toch een plezieriger ambiance verkiezen op een mooie voorjaarsdag..............
Review-g641785-d1140849_3,Review-g641785-d1140849_3:1,Vooraf een menu afgesproken voor een groep van 10 personen.
Review-g641785-d1140849_3,Review-g641785-d1140849_3:2,"Correcte prijs voor een 3-gangen keuzemenu (telkens vis of vlees), inclusief dranken en aperitief."
Review-g641785-d1140849_3,Review-g641785-d1140849_3:3,"Kwaliteit zeker in orde, tot tevredenheid van de deelnemers."
Review-g641785-d1140849_3,Review-g641785-d1140849_3:4,Bedankt!
Review-g641785-d1140849_4,Review-g641785-d1140849_4:1,Via kennissen hadden wij het advies gekregen hier ook eens te gaan tafelen.
Review-g641785-d1140849_4,Review-g641785-d1140849_4:2,Wij gingen hier eten de avond voor valentijn.
Review-g641785-d1140849_4,Review-g641785-d1140849_4:3,Er was nog net een tafeltje van 2 vrij en bestelden de Valentijnsmenu.
Review-g641785-d1140849_4,Review-g641785-d1140849_4:4,Het eten was echt heel lekker en wisten al dadelijk dat we eigenlijk hier vaker moeten komen.
Review-g641785-d1140849_4,Review-g641785-d1140849_4:5,Echt een aanrader om eens lekker te gaan eten.
Review-g641785-d1140849_4,Review-g641785-d1140849_4:6,Bovendien was er aan het einde van de maaltijd nog een leuk kadootje ter attentie van valentijn.
Review-g641788-d6213349_1,Review-g641788-d6213349_1:1,Reserveren een hopeloze zaak.
Review-g641788-d6213349_1,Review-g641788-d6213349_1:2,"2x gereserveerd, 2x niet op de lijst!!!!"
Review-g641788-d6213349_1,Review-g641788-d6213349_1:3,"Bevestigingsmail van Social Deal getoond, kom, geef maar, en zet u!"
Review-g641788-d6213349_1,Review-g641788-d6213349_1:4,welkom!
Review-g641788-d6213349_1,Review-g641788-d6213349_1:5,vergeet het maar...
Review-g641788-d6213349_1,Review-g641788-d6213349_1:6,1/2 uur gewacht op eerste tapas.
Review-g641788-d6213349_1,Review-g641788-d6213349_1:7,"viel redelijk mee, maar aan serranoham met stokbrood kan niet veel tegenvallen."
Review-g641788-d6213349_1,Review-g641788-d6213349_1:8,Nog een 1/2 uur wachten op alweer een miniscule portie.
Review-g641788-d6213349_1,Review-g641788-d6213349_1:9,tapas eten zoveel...als je wilt??
Review-g641788-d6213349_1,Review-g641788-d6213349_1:10,"zij beslissen hoeveel je eet, als je geluk hebt krijg je 4x3 porties, als ze er geen zin in hebben, zul je het met minder moeten doen!"
Review-g641788-d6213349_1,Review-g641788-d6213349_1:11,"Dienster deed haar best, maar de bazin (?) mag best een cursus onthaal volgen, bah bah."
Review-g641788-d6213349_1,Review-g641788-d6213349_1:12,"Kan 'zogezegd' niet goed Nederlands, Wat een lachertje, was zich aan het beklagen tegen bekenden over Social Deal en de toeloop van gasten die deze formule met zich meebracht, in perfekt Nederlands..."
Review-g641788-d6213349_1,Review-g641788-d6213349_1:13,"Bestaat 1 jaar nu, ben benieuwd hoe het er volgend jaar uitziet."
Review-g641788-d6213349_1,Review-g641788-d6213349_1:14,"Denk niet dat veel mensen voor een 2de maal gaan, wat uiteindelijk toch de bedoeling is."
Review-g641788-d6213349_1,Review-g641788-d6213349_1:15,"Gemiste kans, jammer, want aan de kok ligt het niet."
Review-g641788-d6213349_2,Review-g641788-d6213349_2:1,"Met hele gezin gaan eten om 19.00 uur, om 19.30 kregen wij de drankkaart, om 19.40 moesten wij de bestelling voor het eten pas doorgeven."
Review-g641788-d6213349_2,Review-g641788-d6213349_2:2,Niets van de door ons bestelde tapas kwam tegelijk op tafel en er ontbraken ook een aantal tapas die wij wel hadden doorgegeven.
Review-g641788-d6213349_2,Review-g641788-d6213349_2:3,"Bediening zeer slecht, terwijl er niet veel klandizie was."
Review-g641788-d6213349_2,Review-g641788-d6213349_2:4,Alles was hen teveel.
Review-g641788-d6213349_2,Review-g641788-d6213349_2:5,Wij zouden 2 uur onbeperkt tapas kunnen eten maar om 20.55 zei de serveerster dat de keuken om 21.00 uur gesloten was.
Review-g641788-d6213349_2,Review-g641788-d6213349_2:6,"Eten was zeer slecht, we hadden nog beter naar een frituur kunnen gaan!!"
Review-g641788-d6213349_2,Review-g641788-d6213349_2:7,Geen aanrader dus!!!!
