rid,id,text
79,79:0,Being a PC user my whole life....
79,79:1,This computer is absolutely AMAZING!!!
79,79:2,10 plus hours of battery...
79,79:3,super fast processor and really nice graphics card..
79,79:4,and plenty of storage with 250 gb(though I will upgrade this and the ram..)
79,79:5,This computer is really fast and I'm shocked as to how easy it is to get used to...
79,79:6,I've only had mine a day but I'm already used to it...
79,79:7,MACS ARE AMAZING!!!
79,79:8,GET THIS COMPUTER FOR PORTABILITY AND FAST PROCESSING!!!
10,10:0,the laptop was really good and it goes really fast just the way i thought it would of run.
10,10:1,i would really recommend to any person out there to get this laptop cause its really worth it.
10,10:2,and its really cheap and you wont regret buying it.
264,264:0,"As a lifelong Windows user, I was extremely pleased to make the change to Mac."
264,264:1,"As a computer science student in college, I find that the portability, longevity, and ease of use of this computer make me (shockingly) want to do homework more;"
264,264:2,"without a big ol' clunky machine in my backpack, I feel like I can do programming homework anywhere."
264,264:3,I highly recommend this computer for students looking for a solid machine to get them through college.
264,264:4,"A great feature is the spotlight search: one can search for documents by simply typing a keyword, rather than parsing tens of file folders for a document."
24,24:0,Oh my goodness-I am not a happy camper.
24,24:1,My HP is very heavy.
24,24:2,Not easy to carry.
24,24:3,The battery has never worked well.
24,24:4,The battery gets so HOT it is scary.
24,24:5,"Yet, HP won't do anything about the problem."
24,24:6,I returned the computer to HP and they kept it for 3 months.
24,24:7,When I got the computer back and realizwed it still was not correct HP told me it was out of warranty and now it was my problem.
24,24:8,"So, you can imagine how unhappy I am with this item."
24,24:9,Currently if I use the laptop I can't sit it on my lap because it will burn my legs.
24,24:10,I did contact HP and share how unhappy I am.
24,24:11,"Well, they don't care a bunch."
24,24:12,"But, at the same time they (the company) would not and could not do anything about my problem."
24,24:13,I would  say if you want to buy one of these machines be careful.
24,24:14,"And, if you are going to deal with HP be careful."
24,24:15,"In my house, HP is a nasty word."
277,277:0,"Since I purchased my Toshiba netbook, I have been very pleased with it, I have a laptob and a desktop."
277,277:1,The netbook is easier for me to take to bed and carry around with me.
277,277:2,"The screen takes some getting use to, because it is smaller than the laptop."
277,277:3,I have not have any problems.
178,178:0,"The Notebook PC,Toshiba Qosmio is the best gift my father could have ever gotten me."
178,178:1,He gave me this PC about 3 years ago and up to this point im still sitting here using it.
178,178:2,Its still going.
178,178:3,It is in the best condition and has a really high quality.
178,178:4,This is something i would deffinately reccomend to someone.
178,178:5,You will not regret buying such a great thing like this!
178,178:6,It can't get any better.
77,77:0,"Waited on getting this computer, but it has been a great change."
77,77:1,Ease of use is just one of the benefits I love about my Mac.
342,342:0,This laptop meets every expectation and Windows 7 is great!
342,342:1,"It's fast, it's easy easy easy to set up, easy to hook to my wireless network."
342,342:2,It's even easy to hook up to other wireless networks.
342,342:3,The battery doesn't last long but I'm sure an upgrade battery would solve that problem.
342,342:4,I don't use my laptop in a way though that needs a long battery life so it's perfect for me.
348,348:0,"Most everything is fine with this machine: speed, capacity, build."
348,348:1,"The only thing I don't understand is that the resolution of the screen isn't high enough for some pages, such as Yahoo!Mail."
348,348:2,"Yes, I have it on the highest available setting."
347,347:0,I bought it for really cheap also and it's AMAZING.
347,347:1,Easy to start up and does not overheat as much as other laptops.
347,347:2,Recommended to people as their first laptop.
339,339:0,"Plain and simple, it(laptop) runs great and loads fast."
339,339:1,"Easy to carry, can be taken anywhere, can be hooked up to printers,headsets."
339,339:2,Love that it doesn't take up space like a regular computer.
273,273:0,I'm already hooked on the sleek look and dependability that this laptop has shown.
273,273:1,"Being a PC user my whole life, it's taking a bit of time to adapt to the OS of a Mac but I'm finding my way around."
273,273:2,The unibody design is edgy and durable.
273,273:3,The LED backlit display makes my pictures pop so much more.
273,273:4,I'm learning the finger options for the mousepad that allow for quicker browsing of web pages.
273,273:5,"Granted, it's still a very new laptop but in comparison to my previous laptops and desktops, my Mac boots up noticeably quicker."
273,273:6,A key contributor that led me to Mac is the art aspect.
273,273:7,They have developed excellent proprietary software for editing video and pictures and I'm looking forward to utilizing these tools on the regular.
273,273:8,I'm excited to learn more about what this powerful machine has to offer and encourage others to do the same.
273,273:9,It's more expensive but well worth it in the long run.
240,240:0,"Great product, very easy to use and great graphics."
240,240:1,"One drawback, I wish the keys were backlit."
240,240:2,"I'm glad I bought this laptop, it was worth the few ($100) extra dollars."
243,243:0,It had most of the features and all of the power that I wanted to replace my desktop machine.
243,243:1,I wasn't really as concerned about portability (it's a very large laptop) but it's not hard to move around or take on a trip which was a pleasant surprise.
243,243:2,I'm very happy with this machine!
285,285:0,"I love the size, keyboard, the functions."
285,285:1,I don't really have a complaint.
285,285:2,"It is easy to use, good quality and good price."
285,285:3,Perfect trifecta!
285,285:4,I would recommend this product.
212,212:0,The salesman talked us into this computer away from another we were looking at and we have had nothing but problems with software problems and just not happy with it.
93,93:0,This is my first Dell I heard their customer service was lacking and that they were working on improving it!
93,93:1,I purchased this laptop 9 months ago!
93,93:2,The DVD burner broke after burning 3 DVD'd during that time!
93,93:3,They sent me a replacement part and without informing me are requiring that I return it within 15 days or contact them and let them know the broken part will be returned later.
93,93:4,I am currently out of town and called to inform them the broken part would be returned when I got back in town.
93,93:5,If this is an improvement in Customer Service then I would hate too see what it was before!
93,93:6,I spoke to 4 different people and was told they needed to transfer me to a 5th person!
93,93:7,Needless to say I told them No and have a nice day and hung up!
93,93:8,I can guarantee this will be the last Dell I will ever purchase!
93,93:9,Breaking within 1 year of purchase and speaking to 4+ people to report the damaged part will be returned late!
93,93:10,I do not recommend this company or their products!!!!
252,252:0,"So far, a great product."
252,252:1,"High price tag, however."
252,252:2,Still trying to learn how to use it.
19,19:0,it is the worst computer dell ever made.
19,19:1,it is hard to fix and makes it a hassle to own one.
19,19:2,breaks easily.
19,19:3,only good thing is the graphics quality.
165,165:0,There are so many wonderful features and benefits to the new MacBook!
165,165:1,The #1 reason that is always repeated.
165,165:2,No Viruses!
165,165:3,This laptop is fast and you will literally learn all you can do with this dynamo by just watching the online tutorials.
165,165:4,I am loyal to Apple.
165,165:5,The Macbooks worth every penny.
165,165:6,"They're easy, fun, powerful and will last a long time."
165,165:7,"The great 18 month same as cash financing and Advance Protection Plan which includes accidents like spills ., which Apple doesn't offer, is why I bought my MacBook at Best Buy."
165,165:8,I am very Happy!
111,111:0,This just keeps having it's hard drive replaced!
111,111:1,Acer won't replace the laptop.
111,111:2,the manufacturer's warranty only covers replacement/repair of parts.
111,111:3,This thing is a lemon.
292,292:0,This MacBook is an outstanding product with great value.
292,292:1,Its ease of use and the top service from Apple- be it their phone assistance or bellying up to the genius bar- cannot be beat.
292,292:2,"Suffice it to say, my MacBook Pro keeps me going with its long battery life and blazing speed."
292,292:3,It does run a little warm but that is a negligible concern.
359,359:0,I was so excited to receive the Toshiba L455 as a gift/bonus for some work I had done for a friend of mine!
359,359:1,I have owned it only two months!
359,359:2,I have had nothing but problems since the day I took it out of the box!
359,359:3,My first problem was with the pre-loaded Norton Firewall/Security program.
359,359:4,It would not let me connect to my Wifi system where I lived.
359,359:5,It took Toshiba tech support 4 calls and 4 different techs to correct the problem.
359,359:6,"Then just the other day, my left ""mouse"" button snapped!"
359,359:7,"Being only 2 months old, I am not a happy camper!"
359,359:8,Buyer Beware.
359,359:9,"this one, in my opinion, might be a lemon!"
95,95:0,It rarely works and when it does it's incredibly slow.
95,95:1,I have had to take it to the geek squad guys to get it fixed because it has had viruses 3 times and i have not even had it for more then 4 months!
95,95:2,"*IF YOU ARE LOOKING FOR A GOOD LAPTOP, THIS IS NOT IT!"
360,360:0,Like the price and operation.
360,360:1,"Some features arent friendly ( volume wheel, sound quality, etc."
360,360:2,"But, for the cost this is a winner."
66,66:0,I absolutely love my mac!
66,66:1,I can't imagine my life without it anymore!
66,66:2,It's perfect for everything and runs faster than an average pc!
384,384:0,I've haven't had any major problems with the laptop except that the plastic piece that covers the usb port wires have all come off.
384,384:1,Apparently they are defective since they are not securely attached.
384,384:2,I can barely use any usb devices because they will not stay connected properly.
384,384:3,I called Toshiba and they want me to be without my laptop for about two weeks while they look at the problem.
384,384:4,I think I might rather suffer for something that is simple to fix in my opinion.
54,54:0,I bought this laptop Was the worst Laptop I've ever bought.
54,54:1,I spent alot of money on this product and its been a nightmare.
54,54:2,And having to deal with the company has been a even worse nightmare.
54,54:3,I sent it to them to fix in perfect condition but for what was wrong with it.
54,54:4,They sent it back with a huge crack in it and it still didn't work.
54,54:5,And that was the fourth time ive sent it to them to get fixed.
54,54:6,Its been a year and am still waiting to see what there going to do about my laptop.
54,54:7,So if anyones looking to buy a computer or laptop you should stay far far away from any that have the name TOSHIBA on it...
176,176:0,I saved for this laptop for 3 months and I can tell you personally it was worth the wait.
176,176:1,"The display on this computer is the best I've seen in a very long time, the battery life is very long and very convienent."
176,176:2,"A little pricey but it is well, well worth it."
176,176:3,I've been a PC user and I just finally switched and I am never going back.
176,176:4,It is amazing.
59,59:0,In the first moth of owning this computer its hardrive failed which had to be replaced.
59,59:1,After replacing the hard drive the battery stopped working  (3 months of use) which was frustrating.
59,59:2,Then after 4 or so months the charger stopped working so I was forced to go out and buy new hardware just to keep this computer running.
59,59:3,A tip for people looking into this computer: DO NOT BUY IT save up a bit more money and buy a computer that will last.
170,170:0,Has a 5-6 hour battery life.
170,170:1,Much faster than my old windows laptop that died on me.
170,170:2,It is easy to use and lightweight.
170,170:3,Was very much worth the price i paid.
90,90:0,This netbook went bad on me after 3 days.
90,90:1,There is a blank lighted screen when I start and that is all.
90,90:2,I am also upset with CR for giving a good rating.
220,220:0,I purchased this netbook after my original Toshiba laptop crashed right after the warranty expired.
220,220:1,"Three weeks after I bought the netbook, the screen quit working."
220,220:2,I baby my electronics so I know for a fact it was defective and not anything that I did to it.
220,220:3,"Overall I feel this netbook was poor quality, had poor performance, although it did have great battery life when it did work."
278,278:0,Took the netbook on a vacation trip and I was able to do whatever I wanted to do without lugging a much heavier laptop.
278,278:1,To my mind much more usable than the toy called an IPad.
135,135:0,The So called laptop Runs to Slow and I hate it!
135,135:1,Do not  buy it!
135,135:2,It is the worst laptop ever
159,159:0,"The image is great, and the soud is excelent."
159,159:1,i love ths notebook.
57,57:0,I love the glass touchpad.
57,57:1,Easy learning curve.
57,57:2,Also the display is exceptional!
76,76:0,I have loved this since i took it out of the box.
76,76:1,The battery is really long.
76,76:2,"the features are great, the only thing it needs is better speakers."
28,28:0,Small and light weight.
28,28:1,Speakers too small to be of any real use.
28,28:2,Keyboard good sized and wasy to use.
28,28:3,I like it!
267,267:0,Meets my needs perfectly and is light enough for this senior to carry without affecting my arthritis.
132,132:0,"Needless to say, not to happy with the product."
167,167:0,This is a great machine!
167,167:1,"The design is awesome, quality is unprecedented."
169,169:0,"Apparently well-built and gorgeous to look at, the i5 MacBook Pro is a winning combination of price and performance."
197,197:0,It is by far one of the greatest investments I have ever made.
284,284:0,Consumer Report recommended Toshiba.
284,284:1,"Am very glad I bought it, great netbook, low price."
299,299:0,Very good quality and well made.
299,299:1,Great pick for portability and affordability.
299,299:2,The black model also has a very nice seamless appearance - one of the better looking notebooks I've seen.
321,321:0,The only problem is a lack of screen resolutions!
325,325:0,"If you need an affordable, entry-level laptop, this will fit the bill."
325,325:1,"I dislike the weight and size, cubersome."
325,325:2,I dislike the quality and the placement of the speakers.
325,325:3,"Overall, it's ok."
326,326:0,"Laptop is advertised as a 15"" but the casing looks like that of a 17""."
326,326:1,This laptop is very large and barely fits in any carrying cases.
326,326:2,Peformance is good for the price.
326,326:3,"If you're not wanting to be mobile, this is a good laptop to sit on a desk."
8,8:0,Had to have this computer repaired twice in the first 5 months after purchasing it.
8,8:1,Not good for a person who gets online daily.
8,8:2,May be better for the occasional web surfer.
83,83:0,"I just got this laptop for college, and so far I am very happy with it."
83,83:1,I really wanted a Mac over a pc because I used a Mac in high school.
83,83:2,It is so much easier to use
81,81:0,"Good keyboard, long battery life, largest hard drive and windows 7."
81,81:1,And Toshiba is a quality supplier.
80,80:0,I love this little one.
80,80:1,The keyboard has a wonderful nature feel.
80,80:2,I like it better than my big Dell Laptop.
80,80:3,Seriously considering a larger laptop to replace the Dell
44,44:0,great battery life.
44,44:1,Keyboard is reasonable size.
44,44:2,Small screen somewhat limiting but great for travel.
44,44:3,Charger seems large for this class of computer.
200,200:0,"Great Laptop for the price, works well with action pack games."
200,200:1,"The only thing that I have, is the key broad is a little dark to see the letters, would help if it was a little lighter then it is."
200,200:2,but other then that I would give this product a 4 in hafe stars.
206,206:0,Good for every day computing and web browsing.
177,177:0,A great computer for light home use and business use.
177,177:1,Might not make the avid gamer happy but I don't really think that is what this computer is designed for.
177,177:2,"Crisp screen, great battery life, and plenty of storage."
177,177:3,Very happy.
276,276:0,"My son and his family have a hard time financially because he is self-employed so the family had no computer of any kind, and kyle the oldest child is 12 and really need something to help him in school."
276,276:1,so we got a good deal on hsn for an ascer notebook and we bought it for him.
276,276:2,He loves it and it is easy to use and well the schools start teaching the kids early about computers so it was easy for him to get started.
276,276:3,now he mows yards so he can earn the money for the wireless internet.
276,276:4,I would recomend this acer to parents and grandparents it can really help them in school.
191,191:0,MY ONLY PROBLEM IS I CAN NOT REG. THE PRODUCT KEY.
191,191:1,"IT WANT TAKE IT, IT KEEP SAYING ERROR."
191,191:2,"HELP, HELP, OTHER THAN THAT GETS A GREAT LITTLE WONDER."
237,237:0,It's fast and has excellent battery life.
237,237:1,The screen shows great colors.
247,247:0,I was surprised with the performance and quality of this HP Laptop.
247,247:1,the speed is fine.
247,247:2,Laptop is to be used like a Netbook.
247,247:3,"But with A WAY Bigger Screen, and IS able to connect to an HDMI."
247,247:4,Love it.
254,254:0,"I would recommend this computer to anyone searching for the perfect laptop, and the battery life is amazing."
216,216:0,I BOUGHT THIS LAP TOP AND THE CHARGE TIME DOSEN'T LAST AS LONG AS THEY SAY IT WILL MORE LIKE 2 HOURS
242,242:0,This computer is the ideal college companion.
242,242:1,It's software and speed enable it to do amazing things.
338,338:0,I am not happy at all with the product I purchased.
338,338:1,"A cheaper price should not equal a ""cheap"" product."
338,338:2,It was over rated!
364,364:0,The Toshiba laptop was a great purchase.
364,364:1,"The price was very good, and the product is top quality."
364,364:2,"The delivery was fast, and I would not hesitate to purchase this laptop again."
362,362:0,"This is my second laptop,and it is head and shoulders above my first."
362,362:1,It has easy to use features and all the speed and power I could ask for.
362,362:2,True quality at a great price!
357,357:0,I have used a computer at work but having your own personal laptop is AWSOME!
357,357:1,I am enjoying it and the quality it provides is great!
357,357:2,"Toshiba is a great brand, even though I haven't had it for a long time, I am very happy with it!"
330,330:0,"This is the first laptop I've owned, althougth I used several at my previous job."
330,330:1,"The screen graphics and clarity, and sharpness are great."
330,330:2,I've already recommended this laptop to a friend who eye'd the computer when I took it out of my bag.
322,322:0,I like the laptop overall.
322,322:1,The only thing i can say is that the touch pad doesnt work like it should all the time.
322,322:2,Sometimes you really have to tap the pad to get it to work
354,354:0,This is a great little computer for the price.
354,354:1,"Simple to use, and great graphics."
354,354:2,It has everything I would need for a home computer.
354,354:3,I'm very impressed.
301,301:0,It was secure and easy to navigate.
301,301:1,It is everything that I would want in a computer.
301,301:2,"Besides the great look, it is a great machine."
301,301:3,I would definitely not go back to using a PC after using the mac.
301,301:4,Once again apple stands alone at the top of the charts.
369,369:0,"I enjoy very much my new Toshiba, purchased specifially for attending online schooling."
369,369:1,"I have found it very easy to use, very imformative, wonder alerts and tutorials making it very easy for someone like me who is not exactly technologically advanced to learn to use the various features and programs."
369,369:2,"I have found also, it is very easy to be able to access wireless internet access; without having to have extra equipment and/or complicated routes to take to be able to do so."
369,369:3,"I also love the small, convenient size of my laptop, making it a perfect tool for my academic studies."
369,369:4,I am very pleased with my purchase!
371,371:0,This laptop serves all my needs.
371,371:1,Screen size is perfect for portable use in any environment.
371,371:2,Price and purpose is awesome!
373,373:0,I have been very pleased with the performance of this laptop.
373,373:1,"The battery life seems to be very good, and have had no issues with it."
373,373:2,Great product.
382,382:0,The laptop was very easy to set up.
382,382:1,I did not have to call the support line at all.
382,382:2,Everything was so easy.
385,385:0,I purchased two laptops (for my husband and 16 year old daughter).
385,385:1,"My husband uses it mostly for games, email and music."
385,385:2,"My daughter uses it for games, email, facebook, pictures and music."
385,385:3,They were able to set-up with labtops themselves within a few minutes.
385,385:4,It works fine with our wireless and they've had not problems.
385,385:5,It's a great product for a great price!
4,4:0,"Waited on getting this computer, but it has been a great change."
4,4:1,Ease of use is just one of the benefits I love about my Mac.
160,160:0,Purchased as a gift for a friend.
160,160:1,The service I received from Toshiba went above and beyond the call of duty.
160,160:2,"My friend reports the notebook is astonishing in performance, picture quality, and ease of use."
160,160:3,It is extremely portable and easily connects to WIFI at the library and elsewhere.
160,160:4,Just what the doctor ordered.
185,185:0,2nd Mac book I have purchased from MacConnection.
185,185:1,I cannot be happier with the service or product.
64,64:0,power supply went bad after 2 weeks --
64,64:1,after much effort and 10 days ASUS replaced it
64,64:2,The WiFi is very weak.
64,64:3,"I have other computers that get strong signals that don't drop in places that this ""net""book loses its signal."
64,64:4,Summary: Spend your money elsewhere
78,78:0,This is a nicely sized laptop with lots of processing power and long battery life.
78,78:1,Love it so far.
270,270:0,The Toshiba Net book operates very well.
270,270:1,The only objection I have is that after you buy it the windows 7 system is a starter and charges for the upgrade.
214,214:0,"I bought this netbook for traveling, and it's great - light, functional, and meets my needs."
214,214:1,"The touchpad is extremely sensitive, which is the only drawback."
214,214:2,"Otherwise, I love it!"
350,350:0,I shopped around before buying.
350,350:1,I wasn't really sure I wanted to spend that kind of money!
350,350:2,It Was a great deal after all.
350,350:3,I LOVE it!
350,350:4,I should have bought one a long time ago.
350,350:5,Not enough time for me to give it 5 stars!
294,294:0,"I've had the MacBook Pro 15 for about three weeks, and it really is a great computer."
294,294:1,I have only had PCs with Windows before so this takes a little getting use to.
294,294:2,The real stand out on this computer is the feel of the keyboard and it's speed.
294,294:3,"It is fast booting up , shutting down, and connection with the internet."
294,294:4,The one thing I wish it had was a detailed hardcopy manuel.
294,294:5,"I think the manual is somewhere on the hard drive, but I rather have a hard copy."
239,239:0,"If what you need is a machine to do some surfing, email checking, word processing, and watching a movie or two, this is the machine you want."
239,239:1,It's priced very reasonable and works very well right out of the box.
239,239:2,"If you want a little more custom ability, drop a few bucks and upgrade to one of the more robust versions of Win 7 and grab a 2GB stick of memory to spice it all up a bit more."
239,239:3,(I found a 2GB stick for a bit under $50)
239,239:4,"Nice and portable and definitely a decent enough system to keep you entertained while sitting in the airplane for a couple of hours, or at the hotel taking care of some last minute details and documents."
239,239:5,My ONLY issues are:
239,239:6,the screen/video resolution won't increase to a higher resolution then 1024 x 60
239,239:7,"That being said, it still runs video in full screen decently."
239,239:8,"The sound is a bit quiet if you're on a plane, this can easily be overcome with a decent pair of head phones."
239,239:9,"Bottom line, I doubt you'd be overly disappointed if you invest in this machine."
85,85:0,"Okay, let's just start out by saying I am in no way a computer techy."
85,85:1,"I am a wife, mom and a school teacher and a college student."
85,85:2,"Trying to balance all of my roles leaves very little time for me to do anything, so I want to manage my time I do have to be the most efficient."
85,85:3,I work on a PC at home and have used Pc all through college.
85,85:4,"I use the computer to basically check emails, surf the web, print coupons and for my college papers."
85,85:5,I was getting extrememly frustrated when I would want to do these simple taks that I would have to wait and wait and wait for things to download or virus that would clog up my PC.
85,85:6,It would take up too much time to do reaearch for my papers and I would be up hours-just because the computer was too slow.
