rid,id,text
246,246:5,"this computer will last you at least 7 years, thats an amazing life spanned an electronic."
246,246:6,"everything about a mac is wonderful, it takes a little used to learning and getting used to the new system, but you will learn fast and its all worth it."
25,25:0,Not working = bad
25,25:1,"I spent 2200 dollars on a ""top of the line laptop""."
25,25:2,I got the blue screen of death the first month I got it.
25,25:3,"1) Payed $2200 for a ""premium"" laptop"
25,25:4,2) Blue screen first month
25,25:5,3) Horrible customer support-they lost my laptop for a month-got it back 3 months later
25,25:6,"4) Laptop still did not work, blue screen within a week..."
25,25:7,5) Cut my losses and sold it for parts
25,25:8,"Do yourself a favor, this is not a fake story trying to hurt alienware..."
25,25:9,"this company truely does make horrible products and doesnt seem to because they are certain things like this ""never"" happen..."
25,25:10,do a quick search on the internet see if im the only one.
256,256:0,I'm new - just switched from years of PC frustration.
256,256:1,"what an elegant, wonderful machine."
256,256:2,"I'm making the switch and finding that my biggest problem is trying to do things the 'old' way - and Apple does, indeed, have the better idea."
256,256:3,I really wish I had done this years ago.
256,256:4,Pairing it with an iPhone is a pure pleasure - talk about painless syncing - used to take me forever - now it's a snap.
256,256:5,Thank you Best Buy for putting my computer together and installing my first software - you guys were GREAT too!
256,256:6,I love it - never had a computer I was so impressed with - and I've had a lot of laptops and desktops - this one is FAR AND ABOVE THE BEST ONE I EVER HAD BEFORE.
94,94:0,"I tell everyone that I know, friends, family and enemies this is the absolute worst computer i have ever used."
94,94:1,The computer blinks it shuts off at will.
94,94:2,The letter A stopped working after the first week.
94,94:3,when i called to have another one shipped or to get my money back they said the return policy is 23 twenty three days from the date of purchase.
94,94:4,not the day received.
94,94:5,so the fact that the computer does not work on the 24 twenty fourth day is my fault.
94,94:6,they have done absolutely nothing to fix the computer problem.
94,94:7,they have not sent a new one nor called.
94,94:8,i spent eight hundred dollars from a giant paper weight that looks good on a bus.
94,94:9,then on top of it all their cusromer service center is in the middle east.
94,94:10,So when you do call to complain about the hunk of metal you get the joy of speaking with a bunch of people you cant understand.
94,94:11,"Then to make matters worst, there is noone that they can transfer you to."
94,94:12,its sad because their commercials are great.
96,96:0,I had this computer for one month and had to send it in for repair.
96,96:1,Got the computer back a month later and it was still broken sent it out again and they repaired it.
96,96:2,3 weeks went by and the computer keeps crashing and will not open any applications.
96,96:3,DO NOT BUY GATEWAY COMPUTERS THEY ARE JUNK AND THE WARRANTY COMPANY IS HORRIBLE.
96,96:4,YOU WILL NOT BE ABLE TO TALK TO AN AMERICAN WARRANTY SERVICE IS OUT OF COUNTRY.
96,96:5,COMPUTER HAS BEEN AT SERVICE FACILITY MORE THAN IN MY HANDS.
374,374:0,I have had this laptop for a few months now and i would say im pretty satisfied.
374,374:1,The only problems are the sound isnt very loud I have to wear headphones.
374,374:2,Another thing is that after only a month the left mouse key broke and it costed $175 to send it in to fix it.
374,374:3,That whole experience was just ridiculous we sent it in and after they told us that we had to pay $175 to fix it we were like we will just by a portable mouse which would be way cheaper but they refused to send the laptop back until we paid the $175 and it was fixed.
374,374:4,It took a little over 2 weeks until i got it back.
374,374:5,ANd I babyed the heck out of it just one day when i opened it turned it on went to click and it was broke.
374,374:6,I babyed the heck out of it and i still do.
374,374:7,To be honest i think it was faulty equipment or something but idk.
374,374:8,The graphics are great.
374,374:9,The internet speed is spectacular.
374,374:10,The battery life is probably an hour at best.
374,374:11,Oh and it has word and stuff but its a trial verion so after about a month or so when you go to open it it asks for a product key which didnt come with the computer and even after clicking cancel it wont let you use it at all I use the old word processer which works good.
374,374:12,I would recommend it just because of the internet speed probably because thats the only thing i really care about.
374,374:13,I wish the volume could be louder and the mouse didnt break after only a month.
349,349:0,I received this laptop as a gift and let me just tell you that its the worst.
349,349:1,At first it worked well for a month or so then the system board failed and I send it in to toshiba some complaints and three weeks later I then receive my laptop back only to discover that it still has the same problem so now I have to send it back again to get it fixed again.
349,349:2,This computer doesn't do that well with certain games it can't play some and it becomes too hot while playing games.
349,349:3,Oh and if thats not bad enough it doesn't come with a recovery cd so you can make one if you know how to or buy one if you buy it the cost is $25 for two cds.
349,349:4,the whole experiece is horrible so save up and buy a better laptop.
97,97:0,I bought a HP Pavilion DV4-1222nr laptop and have had so many problems with the computer.
97,97:1,"The computer is so slow, even after paying staples the extra money to speed it up."
97,97:2,They said it was a computer error on this type of computer.
97,97:3,"Also, I have alot of trouble with it getting very hot, and not even sitting on anything to make it hot."
97,97:4,"When the computer has been on for several minutes, it will occasionaly just go off by itself."
97,97:5,"Also, the battery does not last very long at all."
97,97:6,I would recommend not buying this product.
97,97:7,I have had no luck with staples or HP to resolve this problem.
97,97:8,I am stuck with a laptop that I cannot do very much with.
97,97:9,"Also, I have had alot of trouble with the keys sticking and will not type correctly."
97,97:10,"Also, I have had alot of trouble with the shift key to go to other lines."
97,97:11,"It gets stuck all of the time you use it, and you have to keep tapping on it to get it to work."
97,97:12,Sometimes the screen even goes black on this computer.
97,97:13,Will probably never buy a HP again.
145,145:0,Purchased a Toshiba Lap top it worked good until just after the warrenty went out.
145,145:1,After the warrenty expired the hard drive went bad and it would have cost more to fix then to replace.
145,145:2,"Before we got this laptop, had a compaq pasaro for 5 years with no problems."
145,145:3,After the bad experience with this computer went back to compaq.
230,230:0,I hate it.
230,230:1,I have had the luxury (sarcasm) of owning 2 of these laptops.
230,230:2,The first fell apart right after the 1-year-warranty.
230,230:3,"During that time, I had to send it back 3 times."
230,230:4,I paid about 18000 for this laptop because of all the bells and whistles and it kept crapping out on me.
230,230:5,None of the techs at HP knew what they were doing.
230,230:6,"They would repair one thing, send it back and it would still have the same problem."
230,230:7,"The processor went on me, the fan went and the motherboard went."
230,230:8,"I wanted to purchase the extended warranty and they refused, because they knew it was trouble."
230,230:9,I had something else go wrong and they said it had to be in good working order to be able to buy the warranty.
230,230:10,I took it to friend who temporarily fixed it and I finally paid about 1500 for the extended warranty.
230,230:11,I sent it back AND THEY LOST IT.
230,230:12,I waited and waited and no laptop.
230,230:13,Finally after months of research the discovered that they mailed it to a Walmart and there probably would be no way to find the box.
230,230:14,"I waited another month for approval and for them to ""BUILD"" me a new laptop."
230,230:15,I was psyched.
230,230:16,I thought all my problems would finally be solved being that my old computer wouldn't go onto our wireless network and I wouldn't have the same problems because it was updated.
230,230:17,Here we are another year later and the computer is doing the same thing.
230,230:18,HP didn't fix it.
230,230:19,I swear they design these things to go to crap after a year so you are stuck and have to buy a new one.
230,230:20,"I use my friends and family's $2000 laptops and they are fast and reliable and HP, well, I'll never buy or recommend an HP to anyone!"
130,130:0,bought notebook 07/2009.
130,130:1,in 5 months the connect quality got worse and worse.
130,130:2,1st time they got it working the next 5 month they had me send it in.
130,130:3,returned it.
130,130:4,5 months dead again.
130,130:5,They say sorry out of warranty.
130,130:6,Summary: They played games with me for the warranty period.
130,130:7,Now 17 months later they want (would not say exact amount) $165.00 to $400 to fix the machine.
130,130:8,They had me send in the machine last April returned it to me in May with no documentation on what was done it anything.
130,130:9,Now the machine won't connect and Toshiba says that they did replace the connection card in May but they only warranty the repair for 30 days and now I'm out of warranty even though this has been a constant 5 month occurance since I bought the netbook.
130,130:10,So buyer beware when buying Toshiba
52,52:0,I bought this laptop the moment unibody product came to the market.
52,52:1,"I also bought one for my wife, and 3 for my office."
52,52:2,"They are wonderful, but very dangerous when it comes to emitting heat."
52,52:3,"I burned my leg, after lifting it from my desk, and for less than 5 second putting it on my lap to clean my coffee table, so I can place it there."
52,52:4,"I had to call Apple 19 times (each time 40 to 75 minutes on the phone), and take it to their store for evaluations, and diagnostics, 5 times."
52,52:5,"This is what they told me: It heats up, and that is the reason we no longer call them laptops, and simply categorize them as portables."
52,52:6,"You might think, I am new in this game, but I am a gadget lover, and have had more than 2 dozens laptops in the past 15 years, and none gets this hot, that fast."
52,52:7,I also experience the same with my MacBook Air.
52,52:8,"So you might ask, what did Apple do for me?"
52,52:9,"For my burn thigh which has put a permanent mark on my skin (it happened 7 months ago) they offered me an ITouch 8Gig (you know it is a bit insulating when a company this rich, offer a loyal customer like me, a bottom of their product line as a gift for events like this)."
52,52:10,"Steve Jobs, probably needs help and donations, and cannot afford a reasonable offers for people that truly are trying to support his baby."
52,52:11,"The lesson learned here is: It does not pay to by this loyal to any brand, since all of them are there to simply  to make as much money as possible, as fast as they can, and in this day and age, the customer no longer is right all the times."
52,52:12,Sad very SAD.
235,235:0,I had meant to purchase the NB205 and bought this one by accident (long story).
235,235:1,"I am not going to sit here and complain about it not having a cd drive and what not because it is a netbook, it is made to be compact and if you want all the other stuff get a laptop."
235,235:2,Anyways I bought this two months ago and when I first brought it home it kept giving me a message about a vibration in the hard drive and it is putting it temporaly in save zone.
235,235:3,"So I called customer support (which is good too) and they went through it and it is just a safety feature and it does not affect performance at all, I just chose to hide the message."
235,235:4,"I have had the netbook for 2 months and I love it, I read some reviews that say netbooks are slow but it does not seem any slower than the other computers I use."
235,235:5,"Also the speakers are not very loud, But it is a netbook."
235,235:6,Would HIGHLY recommend this netbook though.
49,49:0,"I paid for extra memory and the 17-inch screen, as well as the top of the line DVD and CD burners."
49,49:1,I custom ordered the machine from HP and could NOT understand the techie due to his accent.
49,49:2,Finally was able to reach a young lady in California and ordered the machine and was subsequently given a delivery date.
49,49:3,"The leather carrying case, keyboard and mouse arrived in two days from Memphis warehouse."
49,49:4,The computer was two weeks late in delivery because HP forgot to complete the required import paperwork.
49,49:5,"My laptop cost approximately $2,300 and DIED after only 2-years, 10-months and 18-days of use."
49,49:6,"Although my model was listed as recalled, HP denied my claim."
49,49:7,"Accordingly, I have decided to NEVER purchase another HP product (my five year old Compaq) lasted 5-years before the hard drive crashed."
49,49:8,I visited the Apple Store and was impressed with the 17-inch MacBook Pro.
49,49:9,"The quality, engineering design and warranty are superior--covers damage from dropping the laptop."
49,49:10,"If the number of patrons in the Apple store are any indication, HP and other PC manufacturers need to take note."
53,53:0,"This laptop leaves alot to be desired, I have had it only 5 months and have had to send it away to be repaired twice..."
53,53:1,"I bought it from HSN because it was ""bundled"" with extra software, but as it turns out, that software just crashes it more often....."
53,53:2,If you shop around in the current market you can find a much better deal.
53,53:3,"The repairs were made quickly though I must say, however the second time they shipped it to the incorrect address and it took nearly a week for them to get it to me."
60,60:0,Unable to boot up this brand new laptop.
60,60:1,Spent 2 hours on phone with HP Technical Support.
60,60:2,"They went through asking me open up various components, taking battery out, hard disk apart, and after 2 hours on phone could not fix it."
60,60:3,They are asking me to ship the unit back to fix it at their site.
60,60:4,I am going to go back and return at Store I bought from!
89,89:0,This computer had exactly the specifications I needed.
89,89:1,"Small enough to use on a long flight, Light enough to carry through airports and powerful enough to replace my desktop while on long business trips."
89,89:2,The perfect notebook...
89,89:3,When I finally had everything running with all my software installed I plugged in my droid to recharge and the system crashed.
89,89:4,The Aspire wont even boot past the Acer screen with a Droid (I have tried both Motorola and HTC) plugged into the USB port.
89,89:5,"Called tech support and got the usual Acer ""We don't support software but for $$$ we can help you"" I explained there was no software involved in booting."
89,89:6,"No, tey don't even support their own bios and it ""could be a problem with the bios"" How can a company that makes a fairly decent product get away with such insanity??!!"
89,89:7,Needless to say a PC that can't support a cell phone is less than useless!
92,92:0,"With today's company fighting over marketshare, its a shame that ASUS can get away with the inept staff answering thephone."
92,92:1,I agree with the previous comment that ASUS TECH SUPPORT IS HORRIBLE WHICH IS A CON IN MY OPINION.
92,92:2,"Summary: I've had this laptop for 2 months, out of the blue the power adapter stops working."
92,92:3,"Call tech support, standard email the form and fax it back in to us."
92,92:4,"I called back to ensure that received it, they had."
92,92:5,But no one could tell me when my part would be shipped nor could they tell me where to buy it ON THEIR WEBSITE!!!
92,92:6,Frustrated I hung up and tried to call back 3 days later to be told that it takes 2-3 days for turnaround time.
92,92:7,This was the 3rd day and part still had not been shipped.
92,92:8,Asked the customer service rep.
92,92:9,"If it's not shipped on the next business day, called on a Friday they are closed on weekends, what was the next step."
92,92:10,"The rep did not even answer my question, I had to ask him, if he understood what I ask or if he spoke english because he didn't even try to acknowledge my question."
92,92:11,Was searching online for a power supply when I found this site.
92,92:12,I'm tired of the inept service.
92,92:13,If you are looking for a netbook pc DO NOT BUY FROM ASUS!!!
92,92:14,Unless you want to be inconvenienced with a non working power supply which you can't find a replacement for because they made the attachment so small.
92,92:15,I'M REALLY FRUSTRATED BY THIS EXPERIENCE.
92,92:16,HOW DOES THE POWER SUPPLY NOT WORK!!!
92,92:17,"I spoke with a service rep at Micro Center and his girlfriend is having the same problem with her power adapter, so it's not just an isolated incident!!!"
310,310:0,Our Apple 13.3 MacBook Pro Notebook Computer (Z0J80001) Notebook and has become such an integral part of completing our daily needs and social networking.
310,310:1,"I do everything on this computer - check email, facebook, shop, check blogs, write papers, listen to music, and we even watch all of our movies on it since we do not have a tv."
310,310:2,"It pretty much does everything we could ever need, and looks great to boot."
310,310:3,"Apple is always great about the aesthetics of things, they always come up with good looking products."
310,310:4,It didn't take me long to get switched over to the Mac computer programs and navigation - it's been just fine and like the way this laptop functions much better.
310,310:5,"So, if you're thinking of a laptop, I would heartily recommend theApple 13.3 MacBook Pro Notebook Computer (Z0J80001) Notebook for all your needs!"
310,310:6,"It's great and we will always stick with Apple computers, we have been so happy with them."
41,41:0,"I know that everyone thinks Macs are overpriced and overrated, but once you get past the initial expense you'll find that they're worth every penny (besides, there's always the financing plan that Best Buy offers)."
41,41:1,"The 13"" MacBook Pro is portable, durable, and very capable."
41,41:2,"It has a 10 hour battery life when you're doing web browsing and word editing, making it perfect for the classroom or office, and in terms of gaming and movie playing it'll have a battery life of just over 5 hours."
41,41:3,"It's also very energy efficient, running on a quarter of the power it takes to run a 60 Watt lightbulb."
41,41:4,"It's graphics aren't bad at all, for the lower end of the MacBook Pro spectrum, easily capable of running StarCraft II and other games with comparable graphics."
41,41:5,It's also very capable of doing moderate video editing (although you may need the performance boost of the larger MacBook Pros for heavy duty mobile video editing).
41,41:6,"The operating system and user interface is very intuitive, and the large multi-touch track pad is amazing."
41,41:7,"Typically, when I purchase a new laptop I always end up using an external mouse for convenience."
41,41:8,"However, the multi-touch gestures and large tracking area make having an external mouse unnecessary (unless you're gaming)."
41,41:9,"Still, this laptop is perfect for all day use at school and work."
41,41:10,They also have a longer service life than other computers (I have several friends who still use the older Apple PowerBooks).
42,42:0,Me and my boyfriend bought the Gateway NV78 in nov of 09.
42,42:1,Bought with a credit card.
42,42:2,Probbly the worst decision we ever made!
42,42:3,It has bein into the shop to get a new hardrive 2 times and to fix the touch control buttons on the keyboard!
42,42:4,the place we bought it from said that after they send it out to gateway 4 times they would give us a new one.
42,42:5,the last time we took it to get fixed the guy said that most likely it is a reppative problem and will keep happeneing so hopefully we can get a new one very soon!
42,42:6,pretty much everything else about the computer is good it just stops working out of no were.
42,42:7,i love the size of the computer since i play games on it.
42,42:8,i also love having the extra calculator number set up on the keyboard which most laptops do not have.
42,42:9,also the keyboard does not liht up so unless your sitting in a room with some light you cant see anything and thats bad for me because my boyfriend tends to watch tv in the dark at night which leaves me with no way of seeing the keyboard.
42,42:10,So i would not reccomend anyone buying this computer
6,6:0,"First, it does not have a push button to open the lid."
6,6:1,It is held in place magnetically.
6,6:2,There is a little indent to help open it - but good luck with that.
6,6:3,"Once open, the leading edge is razor sharp."
6,6:4,This is the complete opposite to an ergonomic design.
6,6:5,Using this machine is like a mild form of torture.
6,6:6,"In the shop, these MacBooks are encased in a soft rubber enclosure - so you will never know about the razor edge until you buy it, get it home, break the seal and use it (very clever con)."
6,6:7,The much lauded combined touch pad and clicker is a nightmare.
6,6:8,I lost two items I was working on until I figured out what was happening.
6,6:9,"Also, the space bar makes a noisy click every time you use it."
6,6:10,"I hate to say this, but if I could take this back to the shop and get my money back, then I would."
6,6:11,"It is absolutely horrible to use, despite all its so called advanced features."
6,6:12,I regret buying it before understanding how awful it is to use.
6,6:13,"Buy this if you like being tortured, teased, frustrated and wasting twice as much time as you spent using your old Mac."
6,6:14,It's a bummer and one out of five is being kind.
6,6:15,My Mac has gone from being a trusted friend to an adversary.
6,6:16,I'm going to try and keep my old G4 on the road for as long as possible.
6,6:17,"In due course, I'll remove the hard disc from this new MacBook Pro and dump it where it belongs - in the trash."
68,68:0,"This is the first time that I tried and owning a netbook although I have used 3 different laptops in the past 10 years, I find not much difference except of course for the screen size."
68,68:1,But the screen size is not that bad for email and web browsing.
68,68:2,I like this machine because its very lightweight...
68,68:3,very convenient when you travel and the battery life is excellent...
68,68:4,10 hours of battery life is really something else....
68,68:5,I highly recommend that you buy this product.
7,7:0,"I've owned every ""Pro"" model Apple laptop for the last 8 years, this is BY FAR the WORST one I've ever had."
7,7:1,"It crashes, and when it goes flat, it just DIES (like a PC, maybe worse) and I loose all my open documents!"
7,7:2,I Hate it!
70,70:0,It is the easiest computer I have ever used
70,70:1,I have had some excellent computer and have found I had no idea what to do with them
70,70:2,"I saw this one, and I have the most difficult time trying to use them, they've made great dust collectors, I hate putting this computer down"
70,70:3,I LOVE IT!
70,70:4,I can't say enough good for it!
72,72:0,It's A MAC!!
72,72:1,"I fine Apple MC373LL/A 2.66GHz 15"" Macboook Pro Notebook meets all my needs for a laptop computer when on the go."
72,72:2,I like to use it at the race track to handiecap the horse races.
72,72:3,It's face and depanable.
72,72:4,As a graphic arts a retired instructor I still love to play with the graphic with photos and clip art .....
72,72:5,it's just a great toy to have around.
73,73:0,very very slow laptop.
73,73:1,tons of bloatware and junk programs.
73,73:2,can't reinstall with standard os cd because of proprietary hardware drivers.
73,73:3,keys are all in weird places and is way too large for the way it is designed.
73,73:4,lots of extra space but the keyboard is ridiculously small.
266,266:0,Amazing machine.
266,266:1,"It is a big big, but since it has a 18.4"" screen what would you expect!"
266,266:2,It is truly a Desktop Replacement.
266,266:3,Very fast and efficient!
266,266:4,Does a great job with video shot on a Canon 5D MKII.
266,266:5,Very happy with my 7th Toshiba laptop!
259,259:0,"The touchpad is very intuitive, so much so that I never want to use buttons to click again!"
259,259:1,"The computer loads in about a 1/10th of the time that my PC did, and I have all of the programs that were on my PC."
259,259:2,"Of course, I also have several great software packages that came for free including iWork, GarageBand, and iMovie."
259,259:3,I especially appreciate the fact that it has almost zero viruses and spyware problems!
259,259:4,"The only drawback for me is how dirty the screen gets, and rather quickly too."
259,259:5,I'm hoping that I can find a really quick way to clean it without it getting too gross.
259,259:6,I also enjoy the fact that my MacBook Pro laptop allows me to run Windows 7 on it by using the VMWare program.
259,259:7,Now I have the best of both worlds with all of the power and ease of the Mac!
259,259:8,"I also got the added bonus of a 30"" HD Monitor, which really helps to extend my screen and keep my eyes fresh!"
100,100:0,I never have had a good result with this computer.
100,100:1,"I was told by many  that it was a great computer, but we got one of these, and it worked  great for one year, and as soon as the warrenty was up, then it got  really bad."
100,100:2,"They told me it was my loss even though it was the computer, not  what I've done."
